Symbol,Name,Market Cap,Country,IPO Year,Sector,Industry
CUBI,Customers Bancorp Inc Common Stock,1077365002.0,United States,,Finance,Major Banks
CUBI^E,Customers Bancorp Inc Fixed-to-Floating Rate Non-Cumulative Perpetual Preferred Stock Series E,,United States,,,
CUBI^F,Customers Bancorp Inc Fixed-to-Floating Rate Non-Cumulative Perpetual Preferred Stock Series F,,United States,,,
CUE,Cue Biopharma Inc. Common Stock,82019703.0,United States,2018.0,Health Care,Biotechnology: Pharmaceutical Preparations
CUEN,Cuentas Inc. Common Stock,2198016.0,United States,,Technology,Computer Software: Prepackaged Software
CUENW,Cuentas Inc. Warrant,41436.0,United States,,Technology,Computer Software: Prepackaged Software
CUK,Carnival Plc ADS ADS,1952217753.0,United States,,Consumer Discretionary,Marine Transportation
CULL,Cullman Bancorp Inc. Common Stock,76852231.0,United States,2021.0,Finance,Savings Institutions
CULP,Culp Inc. Common Stock,71006872.0,United States,,Consumer Discretionary,Textiles
CURI,CuriosityStream Inc. Class A Common Stock,36586215.0,United States,2020.0,Consumer Discretionary,Movies/Entertainment
CURIW,CuriosityStream Inc. Warrant,1580329.0,United States,2020.0,Consumer Discretionary,Movies/Entertainment
CURO,CURO Group Holdings Corp. Common Stock,35066588.0,United States,2017.0,Finance,Finance: Consumer Services
CURV,Torrid Holdings Inc. Common Stock,243527221.0,,2021.0,Consumer Discretionary,Clothing/Shoe/Accessory Stores
CUTR,Cutera Inc. Common Stock,78977745.0,United States,2004.0,Health Care,Biotechnology: Electromedical & Electrotherapeutic Apparatus
CUZ,Cousins Properties Incorporated Common Stock,2847289020.0,United States,,Real Estate,Real Estate Investment Trusts
CVAC,CureVac N.V. Ordinary Shares,1205387016.0,Germany,2020.0,Health Care,Biotechnology: Pharmaceutical Preparations
CVBF,CVB Financial Corporation Common Stock,2283850504.0,United States,,Finance,Major Banks
CVCO,Cavco Industries Inc. Common Stock When Issued,2265090545.0,United States,,Consumer Discretionary,Homebuilding
CVCY,Central Valley Community Bancorp Common Stock,193830082.0,United States,,Finance,Major Banks
CVE,Cenovus Energy Inc Common Stock,40205651600.0,Canada,,Energy,Oil & Gas Production
CVEO,Civeo Corporation (Canada) Common Shares,296853420.0,,2014.0,Consumer Discretionary,Hotels/Resorts
CVGI,Commercial Vehicle Group Inc. Common Stock,238405599.0,United States,2004.0,Consumer Discretionary,Auto Parts:O.E.M.
CVGW,Calavo Growers Inc. Common Stock,475285992.0,United States,,Consumer Discretionary,Specialty Foods
CVI,CVR Energy Inc. Common Stock,3338118540.0,United States,2007.0,Energy,Integrated oil Companies
CVII,Churchill Capital Corp VII Class A Common Stock,0.0,,2021.0,Finance,Blank Checks
CVKD,Cadrenal Therapeutics Inc. Common Stock,7826675.0,United States,2023.0,Health Care, Medicinal Chemicals and Botanical Products 
CVLG,Covenant Logistics Group Inc. Class A Common Stock,549588901.0,United States,,Industrials,Trucking Freight/Courier Services
CVLT,Commvault Systems Inc. Common Stock,2964175610.0,United States,2006.0,Technology,Computer Software: Prepackaged Software
CVLY,Codorus Valley Bancorp Inc Common Stock,191885811.0,United States,,Finance,Savings Institutions
CVM,Cel-Sci Corporation Common Stock,54112811.0,United States,1997.0,Health Care,Biotechnology: Biological Products (No Diagnostic Substances)
CVNA,Carvana Co. Class A Common Stock,6063159413.0,United States,2017.0,Consumer Discretionary,Retail-Auto Dealers and Gas Stations
CVR,Chicago Rivet & Machine Co. Common Stock,16453228.0,United States,1930.0,Industrials,Industrial Machinery/Components
CVRX,CVRx Inc. Common Stock,269006197.0,United States,2021.0,Health Care,Biotechnology: Electromedical & Electrotherapeutic Apparatus
CVS,CVS Health Corporation Common Stock,90293247450.0,United States,,Consumer Staples,Retail-Drug Stores and Proprietary Stores
CVU,CPI Aerostructures Inc. Common Stock,39946331.0,United States,2022.0,Industrials,Military/Government/Technical
CVV,CVD Equipment Corporation Common Stock,47493908.0,United States,,Technology,Industrial Machinery/Components
CVX,Chevron Corporation Common Stock,316759478782.0,United States,,Energy,Integrated oil Companies
CW,Curtiss-Wright Corporation Common Stock,7850317283.0,United States,,Technology,Industrial Machinery/Components
CWAN,Clearwater Analytics Holdings Inc. Class A Common Stock,4717442340.0,United States,2021.0,Technology,Computer Software: Prepackaged Software
CWBC,Community West Bancshares Common Stock,111516892.0,United States,,Finance,Major Banks
CWBR,CohBar Inc. Common Stock,7209176.0,United States,,Health Care,Biotechnology: Pharmaceutical Preparations
CWCO,Consolidated Water Co. Ltd. Ordinary Shares,444279698.0,Cayman Islands,,Utilities,Water Supply
CWD,CaliberCos Inc. Class A Common Stock,33149819.0,United States,2023.0,Finance,Real Estate
CWEN,Clearway Energy Inc. Class C Common Stock,4348659100.0,United States,2015.0,Utilities,Electric Utilities: Central
CWH,Camping World Holdings Inc. Class A Common Stock,1464420232.0,United States,2016.0,Consumer Discretionary,Retail-Auto Dealers and Gas Stations
CWK,Cushman & Wakefield plc Ordinary Shares,1653656230.0,,2018.0,Finance,Real Estate
CWST,Casella Waste Systems Inc. Class A Common Stock,4465991285.0,United States,1997.0,Utilities,Environmental Services
CWT,California Water Service Group Common Stock,2761040700.0,United States,,Utilities,Water Supply
CX,Cemex S.A.B. de C.V. Sponsored ADR,9025513054.0,Mexico,,Industrials,Building Materials
CXAC,C5 Acquisition Corporation Class A Common Stock,0.0,,2022.0,Finance,Blank Checks
CXAI,CXApp Inc. Class A Common Stock,22506449.0,United States,2021.0,Technology,EDP Services
CXAIW,CXApp Inc. Warrant,1332261.0,United States,2021.0,Technology,EDP Services
CXDO,Crexendo Inc. Common Stock,50393060.0,United States,,Telecommunications,Telecommunications Equipment
CXE,MFS High Income Municipal Trust Common Stock,94892577.0,United States,1989.0,Finance,Investment Managers
CXH,MFS Investment Grade Municipal Trust Common Stock,61676359.0,United States,1989.0,Finance,Investment Managers
CXM,Sprinklr Inc. Class A Common Stock,3683855063.0,United States,2021.0,Technology,Computer Software: Prepackaged Software
CXT,Crane NXT Co. Common Stock,2919930274.0,United States,,Industrials,Office Equipment/Supplies/Services
CXW,CoreCivic Inc. Common Stock,1272093566.0,United States,,Real Estate,Real Estate Investment Trusts
CYAN,Cyanotech Corporation Common Stock,4637018.0,United States,,Health Care, Medicinal Chemicals and Botanical Products 
CYBN,Cybin Inc. Common Shares,120042325.0,Canada,,Health Care,Biotechnology: Pharmaceutical Preparations
CYBR,CyberArk Software Ltd. Ordinary Shares,6927505200.0,Israel,2014.0,Technology,Computer Software: Prepackaged Software
CYCC,Cyclacel Pharmaceuticals Inc. Common Stock,9153403.0,United States,,Health Care,Biotechnology: Pharmaceutical Preparations
CYCCP,Cyclacel Pharmaceuticals Inc. 6% Convertible Preferred Stock,176999508.0,United States,,Health Care,Biotechnology: Pharmaceutical Preparations
CYCN,Cyclerion Therapeutics Inc. Common Stock,7810979.0,United States,,Health Care,Biotechnology: Pharmaceutical Preparations
CYD,China Yuchai International Limited Common Stock,341575304.0,Singapore,1994.0,Industrials,Industrial Machinery/Components
CYH,Community Health Systems Inc. Common Stock,363187276.0,United States,2000.0,Health Care,Hospital/Nursing Management
CYN,Cyngn Inc. Common Stock,14277465.0,United States,2021.0,Technology,EDP Services
CYRX,CryoPort Inc. Common Stock,554288064.0,United States,,Health Care,Biotechnology: Pharmaceutical Preparations
CYT,Cyteir Therapeutics Inc. Common Stock,107994072.0,United States,2021.0,Health Care,Biotechnology: Pharmaceutical Preparations
CYTH,Cyclo Therapeutics Inc. Common Stock,19308449.0,United States,,Health Care,Biotechnology: Biological Products (No Diagnostic Substances)
CYTHW,Cyclo Therapeutics Inc. Warrant,7144126.0,United States,,Health Care,Biotechnology: Biological Products (No Diagnostic Substances)
CYTK,Cytokinetics Incorporated Common Stock,3170813874.0,United States,2004.0,Health Care,Biotechnology: Pharmaceutical Preparations
CYTO,Altamira Therapeutics Ltd. 0.2 Common Shares (Bermuda),1152651.0,Bermuda,2014.0,Health Care,Biotechnology: Pharmaceutical Preparations
CZFS,Citizens Financial Services Inc. Common Stock,229078956.0,United States,,Finance,Major Banks
CZNC,Citizens & Northern Corp Common Stock,271261904.0,United States,,Finance,Major Banks
CZOO,Cazoo Group Ltd Class A Ordinary Shares,17340950.0,,,Consumer Discretionary,Retail-Auto Dealers and Gas Stations
CZR,Caesars Entertainment Inc. Common Stock,9149819603.0,United States,,Consumer Discretionary,Hotels/Resorts
CZWI,Citizens Community Bancorp Inc. Common Stock,94438724.0,United States,2006.0,Finance,Savings Institutions
D,Dominion Energy Inc. Common Stock,34053608975.0,United States,,Utilities,Electric Utilities: Central
DAC,Danaos Corporation Common Stock,1342693000.0,Greece,2006.0,Consumer Discretionary,Marine Transportation
DADA,Dada Nexus Limited American Depositary Shares,950388617.0,China,2020.0,Technology,Computer Software: Programming Data Processing
DAIO,Data I/O Corporation Common Stock,32468852.0,United States,1981.0,Technology,Industrial Machinery/Components
DAKT,Daktronics Inc. Common Stock,416476623.0,United States,1994.0,Consumer Discretionary,Miscellaneous manufacturing industries
DAL,Delta Air Lines Inc. Common Stock,21401593782.0,United States,,Consumer Discretionary,Air Freight/Delivery Services
DALN,DallasNews Corporation Series A Common Stock,23443906.0,United States,,Consumer Discretionary,Newspapers/Magazines
DAN,Dana Incorporated Common Stock ,1850397879.0,United States,,Consumer Discretionary,Auto Parts:O.E.M.
DAO,Youdao Inc. American Depositary Shares each representing one Class A Ordinary Share,517663218.0,,2019.0,Real Estate,Other Consumer Services
DAR,Darling Ingredients Inc. Common Stock,7116492882.0,United States,1997.0,Consumer Staples,Packaged Foods
DARE,Dare Bioscience Inc. Common Stock,40565525.0,United States,2014.0,Health Care,Biotechnology: Pharmaceutical Preparations
DASH,DoorDash Inc. Class A Common Stock,28695007269.0,United States,,Industrials,Industrial Machinery/Components
DATS,DatChat Inc. Common Stock,5974113.0,United States,2021.0,Technology,Computer Software: Prepackaged Software
DATSW,DatChat Inc. Series A Warrant,219234.0,United States,2021.0,Technology,Computer Software: Prepackaged Software
DAVA,Endava plc American Depositary Shares (each representing one Class A Ordinary Share),3332809575.0,United Kingdom,2018.0,Technology,EDP Services
DAVE,Dave Inc. Class A Common Stock,64238507.0,United States,,Technology,Retail: Computer Software & Peripheral Equipment
DAVEW,Dave Inc. Warrants,284040.0,United States,,Technology,Retail: Computer Software & Peripheral Equipment
DAWN,Day One Biopharmaceuticals Inc. Common Stock,875826357.0,United States,2021.0,Health Care,Biotechnology: Pharmaceutical Preparations
DB,Deutsche Bank AG Common Stock,21063000000.0,Germany,,Finance,Major Banks
DBD,Diebold Nixdorf Incorporated Common stock,1454269310.0,United States,2023.0,Miscellaneous,Office Equipment/Supplies/Services
DBGI,Digital Brands Group Inc. Common Stock,1730267.0,United States,2021.0,Consumer Discretionary,Clothing/Shoe/Accessory Stores
DBGIW,Digital Brands Group Inc. Warrant,2061163.0,United States,2021.0,Consumer Discretionary,Clothing/Shoe/Accessory Stores
DBI,Designer Brands Inc. Class A Common Stock,690614349.0,United States,,Consumer Discretionary,Clothing/Shoe/Accessory Stores
DBL,DoubleLine Opportunistic Credit Fund Common Shares of Beneficial Interest,0.0,United States,2012.0,,
DBRG,DigitalBridge Group Inc.,2623386216.0,United States,2014.0,Real Estate,Real Estate Investment Trusts
DBRG^H,DigitalBridge Group Inc. 7.125% Series H ,,United States,,,
DBRG^I,DigitalBridge Group Inc. 7.15% Series I ,,United States,,,
DBRG^J,DigitalBridge Group Inc. 7.125% Series J ,,United States,,,
DBVT,DBV Technologies S.A. American Depositary Shares,215178633.0,France,2014.0,Health Care,Biotechnology: Biological Products (No Diagnostic Substances)
DBX,Dropbox Inc. Class A Common Stock,9576616250.0,United States,2018.0,Technology,Computer Software: Prepackaged Software
DC,Dakota Gold Corp. Common Stock,212640809.0,United States,2022.0,Basic Materials,Precious Metals
DCBO,Docebo Inc. Common Shares,1307686412.0,Canada,,,
DCF,BNY Mellon Alcentra Global Credit Income 2024 Target Term Fund Inc. Common Stock,0.0,,2017.0,Finance,Finance/Investors Services
DCFC,Tritium DCFC Limited Ordinary Shares,48827179.0,Australia,,Technology,Electronic Components
DCFCW,Tritium DCFC Limited Warrant,39529050.0,Australia,,Technology,Electronic Components
DCGO,DocGo Inc. Common Stock,611817326.0,United States,2020.0,Health Care,Managed Health Care
DCI,Donaldson Company Inc. Common Stock,7181174736.0,United States,,Industrials,Pollution Control Equipment
DCO,Ducommun Incorporated Common Stock,687830297.0,United States,,Industrials,Military/Government/Technical
DCOM,Dime Community Bancshares Inc. Common Stock,770520247.0,United States,,Finance,Major Banks
DCOMP,Dime Community Bancshares Inc. Fixed-Rate Non-Cumulative Perpetual Preferred Stock Series A,576579777.0,United States,,Finance,Major Banks
DCPH,Deciphera Pharmaceuticals Inc. Common Stock,836292518.0,United States,2017.0,Health Care,Biotechnology: Pharmaceutical Preparations
DCTH,Delcath Systems Inc. Common Stock,56981297.0,United States,,Health Care,Medical/Dental Instruments
DD,DuPont de Nemours Inc. Common Stock,34181683326.0,United States,2017.0,Industrials,Major Chemicals
DDD,3D Systems Corporation Common Stock,580622827.0,United States,,Technology,Computer peripheral equipment
DDI,DoubleDown Interactive Co. Ltd. American Depository Shares,416248896.0,South Korea,2021.0,Technology,EDP Services
DDL,Dingdong (Cayman) Limited American Depositary Shares (each two representing three Ordinary Shares),443700059.0,,2021.0,Consumer Discretionary,Catalog/Specialty Distribution
DDOG,Datadog Inc. Class A Common Stock,28487827579.0,United States,2019.0,Technology,EDP Services
DDS,Dillard's Inc. Common Stock,5194663273.0,United States,,Consumer Discretionary,Department/Specialty Retail Stores
DDT,Dillard's Capital Trust I,418667489.0,United States,,Consumer Discretionary,Department/Specialty Retail Stores
DE,Deere & Company Common Stock,110549021481.0,United States,,Industrials,Industrial Machinery/Components
DEA,Easterly Government Properties Inc. Common Stock,1022901981.0,United States,2015.0,Real Estate,Real Estate Investment Trusts
DECA,Denali Capital Acquisition Corp. Class A Ordinary Shares,0.0,United States,2022.0,Finance,Blank Checks
DECK,Deckers Outdoor Corporation Common Stock,13278918110.0,United States,1993.0,Consumer Discretionary,Shoe Manufacturing
DEI,Douglas Emmett Inc. Common Stock,1982511610.0,United States,2006.0,Real Estate,Real Estate Investment Trusts
DELL,Dell Technologies Inc. Class C Common Stock ,48585333344.0,United States,2018.0,Technology,Computer Manufacturing
DEN,Denbury Inc. Common Stock,4834674145.0,United States,2020.0,Energy,Oil & Gas Production
DENN,Denny's Corporation Common Stock,487251978.0,United States,,Consumer Discretionary,Restaurants
DEO,Diageo plc Common Stock,86327679545.0,United Kingdom,,Consumer Staples,Beverages (Production/Distribution)
DERM,Journey Medical Corporation Common Stock,55576841.0,United States,2021.0,Health Care,Biotechnology: Pharmaceutical Preparations
DESP,Despegar.com Corp. Ordinary Shares,437977800.0,Argentina,2017.0,Consumer Discretionary,Transportation Services
DFH,Dream Finders Homes Inc. Class A Common Stock,1796058663.0,United States,2022.0,Consumer Discretionary,Homebuilding
DFIN,Donnelley Financial Solutions Inc. Common Stock ,1573269940.0,United States,2016.0,Consumer Discretionary,Other Consumer Services
DFLI,Dragonfly Energy Holdings Corp. Common Stock (NV),69366651.0,United States,2021.0,Technology,Electronic Components
DFLIW,Dragonfly Energy Holdings Corp. Warrant,3003674.0,United States,2021.0,Technology,Electronic Components
DFP,Flaherty & Crumrine Dynamic Preferred and Income Fund Inc. Common Stock,0.0,,2013.0,Finance,Investment Managers
DFS,Discover Financial Services Common Stock,21090611902.0,United States,,Finance,Finance: Consumer Services
DG,Dollar General Corporation Common Stock,25314419164.0,United States,2009.0,Consumer Discretionary,Department/Specialty Retail Stores
DGHI,Digihost Technology Inc. Common Subordinate Voting Shares,28600831.0,Canada,,,
DGICA,Donegal Group Inc. Class A Common Stock,477912961.0,United States,,Finance,Property-Casualty Insurers
DGICB,Donegal Group Inc. Class B Common Stock,457364692.0,United States,1986.0,Finance,Property-Casualty Insurers
DGII,Digi International Inc. Common Stock,880172148.0,United States,1989.0,Technology,Computer peripheral equipment
DGLY,Digital Ally Inc. Common Stock,7141918.0,United States,,Technology,Radio And Television Broadcasting And Communications Equipment
DGX,Quest Diagnostics Incorporated Common Stock,13729707428.0,United States,,Health Care,Medical Specialities
DH,Definitive Healthcare Corp. Class A Common Stock,844646550.0,United States,2021.0,Technology,Computer Software: Prepackaged Software
DHAC,Digital Health Acquisition Corp. Common Stock,0.0,United States,2021.0,Health Care,Medical/Nursing Services
DHACW,Digital Health Acquisition Corp. Warrant,0.0,United States,2021.0,Health Care,Medical/Nursing Services
DHC,Diversified Healthcare Trust Common Shares of Beneficial Interest,449600181.0,United States,,Real Estate,Real Estate Investment Trusts
DHCA,DHC Acquisition Corp. Class A ordinary share,0.0,United States,2021.0,Finance,Blank Checks
DHCAU,DHC Acquisition Corp. Unit,0.0,United States,2021.0,Finance,Blank Checks
DHCNI,Diversified Healthcare Trust 5.625% Senior Notes due 2042,2952973986.0,United States,,Real Estate,Real Estate Investment Trusts
DHCNL,Diversified Healthcare Trust 6.25% Senior Notes Due 2046,3047689758.0,United States,,Real Estate,Real Estate Investment Trusts
DHF,BNY Mellon High Yield Strategies Fund Common Stock,0.0,United States,1998.0,Finance,Finance Companies
DHI,D.R. Horton Inc. Common Stock,34611121463.0,United States,,Consumer Discretionary,Homebuilding
DHIL,Diamond Hill Investment Group Inc. Class A Common Stock,474997692.0,United States,,Finance,Investment Managers
DHR,Danaher Corporation Common Stock,153333583514.0,United States,,Industrials,Industrial Machinery/Components
DHT,DHT Holdings Inc.,1715144250.0,Jersey,2005.0,Consumer Discretionary,Marine Transportation
DHX,DHI Group Inc. Common Stock,129715398.0,United States,2007.0,Consumer Discretionary,Business Services
DHY,Credit Suisse High Yield Bond Fund Common Stock,0.0,United States,1998.0,Finance,Finance/Investors Services
DIAX,Nuveen Dow 30SM Dynamic Overwrite Fund Common Shares of Beneficial Interest,0.0,,2014.0,Finance,Finance Companies
DIBS,1stdibs.com Inc. Common Stock,143488753.0,United States,2021.0,Consumer Discretionary,Catalog/Specialty Distribution
DIN,Dine Brands Global Inc. Common Stock,795914306.0,United States,,Consumer Discretionary,Restaurants
DINO,HF Sinclair Corporation Common Stock,10524973506.0,United States,1960.0,Energy,Oil & Gas Production
DIOD,Diodes Incorporated Common Stock,3517188303.0,United States,,Technology,Semiconductors
DIS,Walt Disney Company (The) Common Stock,153390355882.0,United States,,Consumer Discretionary,Movies/Entertainment
DISAW,Disruptive Acquisition Corporation I Warrant,0.0,United States,2021.0,Finance,Blank Checks
DISH,DISH Network Corporation Class A Common Stock,2693319755.0,United States,1995.0,Telecommunications,Cable & Other Pay Television Services
DIST,Distoken Acquisition Corporation Ordinary Shares,0.0,China,2023.0,Finance,Blank Checks
DISTR,Distoken Acquisition Corporation Right,0.0,China,2023.0,Finance,Blank Checks
DIT,AMCON Distributing Company Common Stock,108352729.0,United States,1999.0,Consumer Discretionary,Food Distributors
DJCO,Daily Journal Corp. (S.C.) Common Stock,419786376.0,United States,,Consumer Discretionary,Newspapers/Magazines
DK,Delek US Holdings Inc. Common Stock,1793511680.0,United States,2017.0,Energy,Integrated oil Companies
DKDCA,Data Knights Acquisition Corp. Class A Common Stock,75097733.0,United Kingdom,2021.0,Health Care,Biotechnology: Commercial Physical & Biological Resarch
DKDCU,Data Knights Acquisition Corp. Unit,0.0,United Kingdom,2021.0,Health Care,Biotechnology: Commercial Physical & Biological Resarch
DKDCW,Data Knights Acquisition Corp. Warrant,266476.0,United Kingdom,2021.0,Health Care,Biotechnology: Commercial Physical & Biological Resarch
DKL,Delek Logistics Partners L.P. Common Units representing Limited Partner Interests,1863309024.0,United States,2012.0,Energy,Natural Gas Distribution
DKNG,DraftKings Inc. Class A Common Stock,24111378144.0,United States,2019.0,Consumer Discretionary,Services-Misc. Amusement & Recreation
DKS,Dick's Sporting Goods Inc Common Stock,9364448199.0,United States,2002.0,Consumer Discretionary,Other Specialty Stores
DLA,Delta Apparel Inc. Common Stock,62108777.0,United States,2000.0,Consumer Staples,Apparel
DLB,Dolby Laboratories Common Stock,7705815029.0,United States,2005.0,Miscellaneous,Multi-Sector Companies
DLHC,DLH Holdings Corp.,194043567.0,United States,,Consumer Discretionary,Business Services
DLNG,Dynagas LNG Partners LP Common Units,93109685.0,Greece,,Consumer Discretionary,Marine Transportation
DLNG^A,Dynagas LNG Partners LP 9.00% Series A Cumulative Redeemable Preferred Units,,Greece,,,
DLNG^B,Dynagas LNG Partners LP 8.75% Series B Fixed to Floating Rate Cumulative Redeemable Perpetual Preferred Units liquidation preference $25.00 per Uni,,Greece,,,
DLO,DLocal Limited Class A Common Shares,2981202900.0,Uruguay,2021.0,Consumer Discretionary,Business Services
DLPN,Dolphin Entertainment Inc. Common Stock,25206193.0,United States,,Consumer Discretionary,Other Consumer Services
DLR,Digital Realty Trust Inc. Common Stock,35916457852.0,United States,2004.0,Real Estate,Real Estate Investment Trusts
DLR^J,Digital Realty Trust Inc. 5.250% Series J Cumulative Redeemable Preferred Stock,,United States,,,
DLR^K,Digital Realty Trust Inc. 5.850% Series K Cumulative Redeemable Preferred Stock par value $0.01 per share,,United States,,,
DLR^L,Digital Realty Trust Inc. 5.200% Series L Cumulative Redeemable Preferred Stock,,United States,,,
DLTH,Duluth Holdings Inc. Class B Common Stock,182908775.0,United States,2015.0,Consumer Discretionary,Clothing/Shoe/Accessory Stores
DLTR,Dollar Tree Inc. Common Stock,24911226955.0,United States,1995.0,Consumer Discretionary,Department/Specialty Retail Stores
DLX,Deluxe Corporation Common Stock,795347899.0,United States,,Consumer Discretionary,Publishing
DLY,DoubleLine Yield Opportunities Fund Common Shares of Beneficial Interest,668843617.0,United States,2020.0,Finance,Investment Managers
DM,Desktop Metal Inc. Class A Common Stock,352405167.0,United States,2019.0,Technology,Industrial Machinery/Components
DMA,Destra Multi-Alternative Fund Common Stock,0.0,,2022.0,Finance,Trusts Except Educational Religious and Charitable
DMAC,DiaMedica Therapeutics Inc. Common Stock,80832269.0,United States,2018.0,Health Care,Pharmaceuticals and Biotechnology
DMAQ,Deep Medicine Acquisition Corp. Class A Common Stock,0.0,United States,2021.0,Industrials,Consumer Electronics/Appliances
DMAQR,Deep Medicine Acquisition Corp. Rights,0.0,United States,2021.0,,
DMB,BNY Mellon Municipal Bond Infrastructure Fund Inc. Common Stock,0.0,,2013.0,Finance,Trusts Except Educational Religious and Charitable
DMF,BNY Mellon Municipal Income Inc. Common Stock,340108063.0,United States,1988.0,Finance,Finance/Investors Services
DMK,DMK Pharmaceuticals Corporation Common Stock,5460118.0,United States,,Health Care,Biotechnology: Pharmaceutical Preparations
DMLP,Dorchester Minerals L.P. Common Units Representing Limited Partnership Interests,1121387013.0,United States,,Energy,Oil & Gas Production
DMO,Western Asset Mortgage Opportunity Fund Inc. Common Stock,0.0,United States,2010.0,Finance,Trusts Except Educational Religious and Charitable
DMRC,Digimarc Corporation Common Stock,563312546.0,United States,,Technology,EDP Services
DMTK,DermTech Inc. Common Stock,42435648.0,United States,2017.0,Health Care,Medical Specialities
DMYY,dMY Squared Technology Group Inc. Class A Common Stock,0.0,,2022.0,Finance,Blank Checks
DNA,Ginkgo Bioworks Holdings Inc. Class A Common Stock,3316187712.0,United States,2021.0,Health Care,Biotechnology: Biological Products (No Diagnostic Substances)
DNB,Dun & Bradstreet Holdings Inc. Common Stock,4293434375.0,United States,2020.0,Finance,Finance: Consumer Services
DNLI,Denali Therapeutics Inc. Common Stock,2595904055.0,United States,2017.0,Health Care,Biotechnology: Biological Products (No Diagnostic Substances)
DNMR,Danimer Scientific Inc. Common Stock,166827662.0,United States,2020.0,Industrials,Major Chemicals
DNN,Denison Mines Corp Ordinary Shares (Canada),1284939733.0,Canada,,Basic Materials,Other Metals and Minerals
DNOW,NOW Inc. Common Stock,1256082654.0,United States,2014.0,Industrials,Metal Fabrications
DNP,DNP Select Income Fund Inc. Common Stock,0.0,United States,1987.0,Finance,Investment Managers
DNTH,Dianthus Therapeutics Inc. Common Stock,186999374.0,United States,2018.0,Health Care,Biotechnology: Pharmaceutical Preparations
DNUT,Krispy Kreme Inc. Common Stock,2132776000.0,United States,2021.0,Consumer Staples,Food Chains
DO,Diamond Offshore Drilling Inc. Common Stock,1400788207.0,United States,2022.0,Energy,Oil & Gas Production
DOC,Physicians Realty Trust Common Shares of Beneficial Interest,2719572386.0,United States,2013.0,Real Estate,Real Estate Investment Trusts
