Symbol,Name,Market Cap,Country,IPO Year,Sector,Industry
IX,Orix Corp Ads Common Stock,22599059095.0,Japan,,Finance,Diversified Financial Services
IXAQU,IX Acquisition Corp. Unit,0.0,United Kingdom,2021.0,Finance,Blank Checks
IXHL,Incannex Healthcare Limited American Depositary Shares,57957240.0,Australia,,,
IZEA,IZEA Worldwide Inc. Common Stock,34601922.0,United States,,Consumer Discretionary,Advertising
IZM,ICZOOM Group Inc. Class A Ordinary Shares,51260336.0,China,2023.0,Consumer Discretionary,Consumer Electronics/Video Chains
J,Jacobs Solutions Inc. Common Stock,16909467790.0,United States,2022.0,Industrials,Military/Government/Technical
JACK,Jack In The Box Inc. Common Stock,1298572315.0,United States,,Consumer Discretionary,Restaurants
JAGX,Jaguar Health Inc. Common Stock,6899408.0,United States,2015.0,Health Care,Biotechnology: Pharmaceutical Preparations
JAKK,JAKKS Pacific Inc. Common Stock,176382853.0,United States,1996.0,Consumer Discretionary,Recreational Games/Products/Toys
JAMF,Jamf Holding Corp. Common Stock,1973944019.0,United States,2020.0,Technology,Computer Software: Prepackaged Software
JAN,JanOne Inc. Common Stock (NV),1316092.0,United States,,Consumer Discretionary,Home Furnishings
JANX,Janux Therapeutics Inc. Common Stock,336582619.0,United States,2021.0,Health Care,Biotechnology: Pharmaceutical Preparations
JAZZ,Jazz Pharmaceuticals plc Common Stock (Ireland),8216680108.0,Ireland,2007.0,Health Care,Biotechnology: Pharmaceutical Preparations
JBGS,JBG SMITH Properties Common Shares ,1472976016.0,United States,2017.0,Real Estate,Real Estate Investment Trusts
JBHT,J.B. Hunt Transport Services Inc. Common Stock,18600478911.0,United States,,Industrials,Trucking Freight/Courier Services
JBI,Janus International Group Inc. Common Stock,1419083593.0,United States,2021.0,Industrials,Building Products
JBL,Jabil Inc. Common Stock,17552807767.0,United States,1993.0,Technology,Electrical Products
JBLU,JetBlue Airways Corporation Common Stock,1507957703.0,United States,2002.0,Consumer Discretionary,Air Freight/Delivery Services
JBSS,John B. Sanfilippo & Son Inc. Common Stock,1160632542.0,United States,1991.0,Consumer Staples,Specialty Foods
JBT,John Bean Technologies Corporation Common Stock,3214354687.0,United States,,Industrials,Industrial Machinery/Components
JCE,Nuveen Core Equity Alpha Fund Common Shares of Beneficial Interest,0.0,United States,2007.0,Finance,Trusts Except Educational Religious and Charitable
JCI,Johnson Controls International plc Ordinary Share,34128254506.0,Switzerland,,Industrials,Industrial Machinery/Components
JCSE,JE Cleantech Holdings Limited Ordinary Shares,6508667.0,Singapore,2022.0,Consumer Discretionary,Miscellaneous manufacturing industries
JCTCF,Jewett-Cameron Trading Company Common Shares,16269880.0,United States,,Consumer Discretionary,RETAIL: Building Materials
JD,JD.com Inc. American Depositary Shares,39547010446.0,China,2014.0,Consumer Discretionary,Other Specialty Stores
JEF,Jefferies Financial Group Inc. Common Stock,6859944520.0,United States,,Finance,Investment Bankers/Brokers/Service
JELD,JELD-WEN Holding Inc. Common Stock,992440468.0,United States,2017.0,Basic Materials,Forest Products
JEQ,abrdn Japan Equity Fund Inc. Common Stock,70449308.0,United States,1992.0,Consumer Discretionary,Air Freight/Delivery Services
JEWL,Adamas One Corp. Common Stock,14802932.0,United States,2022.0,Consumer Discretionary,Consumer Specialties
JFBR,Jeffs' Brands Ltd Ordinary Shares,3339470.0,Israel,2022.0,Consumer Discretionary,Other Specialty Stores
JFIN,Jiayin Group Inc. American Depositary Shares,271968122.0,China,2019.0,Finance,Finance: Consumer Services
JFR,Nuveen Floating Rate Income Fund Common Stock,0.0,United States,2004.0,Finance,Trusts Except Educational Religious and Charitable
JFU,9F Inc. American Depositary Shares,33238474.0,China,2019.0,Finance,Finance: Consumer Services
JG,Aurora Mobile Limited American Depositary Shares,13408304.0,China,2018.0,Technology,Computer Software: Programming Data Processing
JGGC,Jaguar Global Growth Corporation I Class A Ordinary Shares,0.0,United States,2022.0,Finance,Blank Checks
JGGCR,Jaguar Global Growth Corporation I Right,0.0,United States,2022.0,Finance,Blank Checks
JGGCW,Jaguar Global Growth Corporation I Warrant,0.0,United States,2022.0,Finance,Blank Checks
JGH,Nuveen Global High Income Fund Common Shares of Beneficial Interest,0.0,United States,2014.0,Finance,Investment Managers
JHAA,Nuveen Corporate Income 2023 Target Term Fund,74911831.0,,2018.0,Finance,Finance/Investors Services
JHG,Janus Henderson Group plc Ordinary Shares,3904556821.0,United Kingdom,2017.0,Finance,Investment Managers
JHI,John Hancock Investors Trust Common Stock,102748427.0,United States,,Finance,Trusts Except Educational Religious and Charitable
JHS,John Hancock Income Securities Trust Common Stock,116407617.0,United States,,Finance,Finance Companies
JHX,James Hardie Industries plc American Depositary Shares (Ireland),11135398096.0,Ireland,,Industrials,Building Materials
JILL,J. Jill Inc. Common Stock,313628014.0,United States,2017.0,Consumer Discretionary,Apparel
JJSF,J & J Snack Foods Corp. Common Stock,2948638675.0,United States,1986.0,Consumer Staples,Specialty Foods
JKHY,Jack Henry & Associates Inc. Common Stock,10570123860.0,United States,1985.0,Technology,Retail: Computer Software & Peripheral Equipment
JKS,JinkoSolar Holding Company Limited American Depositary Shares (each representing 4 Common Shares),1520014644.0,China,2010.0,Technology,Semiconductors
JLL,Jones Lang LaSalle Incorporated Common Stock,6295476641.0,United States,,Finance,Real Estate
JLS,Nuveen Mortgage and Income Fund,0.0,United States,2009.0,Finance,Investment Managers
JMIA,Jumia Technologies AG American Depositary Shares each representing two Ordinary Shares,236951339.0,,2019.0,Consumer Discretionary,Catalog/Specialty Distribution
JMM,Nuveen Multi-Market Income Fund (MA),0.0,United States,,Finance,Trusts Except Educational Religious and Charitable
JMSB,John Marshall Bancorp Inc. Common Stock,251727779.0,United States,,Finance,Major Banks
JNJ,Johnson & Johnson Common Stock,393587955315.0,United States,,Health Care,Biotechnology: Pharmaceutical Preparations
JNPR,Juniper Networks Inc. Common Stock,8115949831.0,United States,1999.0,Telecommunications,Computer Communications Equipment
JNVR,Janover Inc. Common Stock,0.0,United States,2023.0,,
JOAN,JOANN Inc. Common Stock,30612165.0,United States,2021.0,Consumer Discretionary,Other Specialty Stores
JOB,GEE Group Inc. Common Stock,65907388.0,United States,1968.0,Consumer Discretionary,Diversified Commercial Services
JOBY,Joby Aviation Inc. Common Stock,4308493970.0,United States,2020.0,Consumer Discretionary,Aerospace
JOE,St. Joe Company (The) Common Stock,2925022924.0,United States,,Real Estate,Homebuilding
JOF,Japan Smaller Capitalization Fund Inc Common Stock,0.0,United States,1990.0,Finance,Trusts Except Educational Religious and Charitable
JOUT,Johnson Outdoors Inc. Class A Common Stock,528641440.0,United States,,Consumer Discretionary,Recreational Games/Products/Toys
JPC,Nuveen Preferred & Income Opportunities Fund,0.0,United States,2003.0,Finance,Investment Managers
JPI,Nuveen Preferred and Income Term Fund Common Shares of Beneficial Interest,377111259.0,,2012.0,Finance,Finance Companies
JPM,JP Morgan Chase & Co. Common Stock,423852537067.0,United States,,Finance,Major Banks
JPM^C,J P Morgan Chase & Co Depositary Shares each representing a 1/400th interest in a share of 6.00% Non-Cumulative  Preferred Stock Series EE,,United States,,,
JPM^D,J P Morgan Chase & Co Depositary Shares each representing a 1/400th  interest in a share of 5.75% Non-Cumulative  Preferred Stock Series DD,,United States,,,
JPM^J,J P Morgan Chase & Co Depositary Shares each representing a 1/400th interest in a share of JPMorgan Chase & Co. 4.75% Non-Cumulative Preferred Stock Series GG,,United States,,,
JPM^K,J P Morgan Chase & Co Depositary Shares each representing a 1/400th interest in a share of 4.55% Non-Cumulative Preferred Stock Series JJ,,United States,,,
JPM^L,J P Morgan Chase & Co Depositary Shares each representing a 1/400th interest in a share of 4.625% Non-Cumulative Preferred Stock Series LL,,United States,,,
JPM^M,J P Morgan Chase & Co Depositary Shares each representing a 1/400th interest in a share of 4.20% Non-Cumulative Preferred Stock Series MM,,United States,,,
JPS,Nuveen Preferred & Income Securities Fund,0.0,United States,2002.0,Finance,Investment Managers
JPT,Nuveen Preferred and Income Fund Common Shares of Beneficial Interest,65523469.0,United States,2017.0,Finance,Trusts Except Educational Religious and Charitable
JQC,Nuveen Credit Strategies Income Fund Shares of Beneficial Interest,0.0,United States,2003.0,Finance,Finance Companies
JRI,Nuveen Real Asset Income and Growth Fund Common Shares of Beneficial Interest,0.0,United States,2012.0,Finance,Finance Companies
JRS,Nuveen Real Estate Income Fund Common Shares of Beneficial Interest,0.0,United States,2001.0,Finance,Finance/Investors Services
JRSH,Jerash Holdings (US) Inc. Common Stock,38236952.0,United States,2018.0,Consumer Discretionary,Apparel
JRVR,James River Group Holdings Ltd. Common Shares,551505520.0,Bermuda,2014.0,Finance,Property-Casualty Insurers
JSM,Navient Corporation 6% Senior Notes due December 15 2043,2034192462.0,United States,,Finance,Finance: Consumer Services
JSPR,Jasper Therapeutics Inc. Common Stock,83332991.0,United States,2020.0,Health Care,Biotechnology: Biological Products (No Diagnostic Substances)
JSPRW,Japer Therapeutics Inc. Warrants,12697727.0,United States,2020.0,Health Care,Biotechnology: Biological Products (No Diagnostic Substances)
JT,Jianpu Technology Inc. American depositary shares,20797951.0,,2017.0,Technology,EDP Services
JTAI,Jet.AI Inc. Common Stock,19173095.0,Cayman Islands,2021.0,Finance,Blank Checks
JTAIW,Jet.AI Inc. Warrant,0.0,Cayman Islands,2021.0,Finance,Blank Checks
JTAIZ,Jet.AI Inc. Merger Consideration Warrants,0.0,Cayman Islands,,,
JVA,Coffee Holding Co. Inc. Common Stock,4212946.0,United States,2005.0,Consumer Staples,Packaged Foods
JWEL,Jowell Global Ltd. Ordinary Shares,9792440.0,China,2021.0,Consumer Discretionary,Other Consumer Services
JWN,Nordstrom Inc. Common Stock,2250563537.0,United States,,Consumer Discretionary,Clothing/Shoe/Accessory Stores
JWSM,Jaws Mustang Acquisition Corp. Class A Ordinary Shares,0.0,,2021.0,Finance,Blank Checks
JXJT,JX Luxventure Limited Common Stock,8059800.0,China,2013.0,Consumer Staples,Apparel
JXN,Jackson Financial Inc. Class A Common Stock ,3303463814.0,United States,2021.0,Finance,Life Insurance
JXN^A,Jackson Financial Inc. Depositary Shares each representing a 1/1000th interest in a share of Fixed-Rate Reset Noncumulative Perpetual Preferred Stock Series A,,United States,,,
JYD,Jayud Global Logistics Limited Class A Ordinary Shares,38984094.0,China,2023.0,Consumer Discretionary,Oil Refining/Marketing
JYNT,The Joint Corp. Common Stock,122167699.0,United States,2014.0,Miscellaneous,Multi-Sector Companies
JZ,Jianzhi Education Technology Group Company Limited American Depositary Shares,33910800.0,China,2022.0,Real Estate,Other Consumer Services
JZXN,Jiuzi Holdings Inc. Ordinary Shares,2205089.0,China,2021.0,Consumer Discretionary,Retail-Auto Dealers and Gas Stations
K,Kellanova Common Stock,17161839018.0,United States,,Consumer Staples,Packaged Foods
KA,Kineta Inc. Common Stock,35774433.0,United States,2016.0,Health Care,Biotechnology: Pharmaceutical Preparations
KACL,Kairous Acquisition Corp. Limited Ordinary Shares,0.0,Malaysia,2022.0,Finance,Blank Checks
KACLR,Kairous Acquisition Corp. Limited Rights,0.0,Malaysia,2022.0,Finance,Blank Checks
KAI,Kadant Inc Common Stock,2663091795.0,United States,1992.0,Industrials,Industrial Machinery/Components
KALA,KALA BIO Inc. Common Stock,20123563.0,United States,2017.0,Health Care,Biotechnology: Pharmaceutical Preparations
KALU,Kaiser Aluminum Corporation Common Stock,1082249689.0,United States,,Industrials,Metal Fabrications
KALV,KalVista Pharmaceuticals Inc. Common Stock,299998154.0,United Kingdom,2015.0,Health Care,Biotechnology: Pharmaceutical Preparations
KAMN,Kaman Corporation Common Stock,551127519.0,United States,,Industrials,Military/Government/Technical
KAR,OPENLANE Inc. Common Stock,1546050265.0,United States,2009.0,Consumer Discretionary,Retail-Auto Dealers and Gas Stations
KARO,Karooooo Ltd. Ordinary Shares,727973108.0,Singapore,2021.0,Technology,Computer Software: Prepackaged Software
KAVL,Kaival Brands Innovations Group Inc. Common Stock,21282468.0,United States,,Health Care, Medicinal Chemicals and Botanical Products 
KB,KB Financial Group Inc,16386071958.0,South Korea,,Finance,Commercial Banks
KBH,KB Home Common Stock,3420221180.0,United States,1986.0,Consumer Discretionary,Homebuilding
KBNT,Kubient Inc. Common Stock,3615488.0,United States,2020.0,Technology,EDP Services
KBNTW,Kubient Inc. Warrant,733055.0,United States,2020.0,Technology,EDP Services
KBR,KBR Inc. Common Stock,8088230806.0,United States,2006.0,Industrials,Military/Government/Technical
KC,Kingsoft Cloud Holdings Limited American Depositary Shares,1197396282.0,China,2020.0,Technology,Computer Software: Prepackaged Software
KCGI,Kensington Capital Acquisition Corp. V Class A Ordinary Shares,0.0,,2021.0,Finance,Blank Checks
KD,Kyndryl Holdings Inc. Common Stock,3421936387.0,United States,2021.0,Technology,EDP Services
KDP,Keurig Dr Pepper Inc. Common Stock,40108330618.0,United States,,Consumer Staples,Beverages (Production/Distribution)
KE,Kimball Electronics Inc. Common Stock,638628178.0,United States,,Technology,Electrical Products
KELYA,Kelly Services Inc. Class A Common Stock,637458241.0,United States,,Consumer Discretionary,Professional Services
KELYB,Kelly Services Inc. Class B Common Stock,668959509.0,United States,,Consumer Discretionary,Professional Services
KEN,Kenon Holdings Ltd. Ordinary Shares,1138695700.0,Singapore,2015.0,Utilities,Electric Utilities: Central
KEP,Korea Electric Power Corporation Common Stock,7915417069.0,South Korea,1994.0,Industrials,Electrical Products
KEQU,Kewaunee Scientific Corporation Common Stock,51721914.0,United States,,Industrials,Medical Specialities
KERN,Akerna Corp. Common Stock,2049590.0,United States,2018.0,Technology,EDP Services
KERNW,Akerna Corp Warrant,177106.0,United States,2018.0,Technology,EDP Services
KEX,Kirby Corporation Common Stock,4912915000.0,United States,,Consumer Discretionary,Marine Transportation
KEY,KeyCorp Common Stock,10070487601.0,United States,,Finance,Major Banks
KEY^I,KeyCorp Depositary Shares Each Representing a 1/40th Ownership Interest in a Share of Fixed-to-Floating Rate Perpetual Non-Cumulative Preferred Stock Series E,,United States,,,
KEY^J,KeyCorp Depositary Shares each representing a 1/40th ownership interest in a share of Fixed Rate Perpetual Non-Cumulative Preferred Stock Series F,,United States,,,
KEY^K,KeyCorp Depositary Shares each representing a 1/40th ownership interest in a share of Fixed Rate Perpetual Non-Cumulative Preferred Stock Series G,,United States,,,
KEY^L,KeyCorp Depositary Shares each representing a 1/40th ownership interest in a share of Fixed Rate Perpetual Non-Cumulative Preferred Stock Series H,,United States,,,
KEYS,Keysight Technologies Inc. Common Stock,22187066144.0,United States,2014.0,Industrials,Industrial Machinery/Components
KF,Korea Fund Inc. (The) New Common Stock,0.0,United States,,Finance,Investment Managers
KFFB,Kentucky First Federal Bancorp Common Stock,37118022.0,United States,2005.0,Finance,Savings Institutions
KFRC,Kforce Inc. Common Stock,1155635161.0,United States,1995.0,Consumer Discretionary,Professional Services
KFS,Kingsway Financial Services Inc. Common Stock (DE),181966331.0,Canada,,Finance,Property-Casualty Insurers
KFY,Korn Ferry Common Stock,2524551729.0,United States,1999.0,Consumer Discretionary,Diversified Commercial Services
KGC,Kinross Gold Corporation Common Stock,6549135459.0,Canada,2001.0,,
KGEI,Kolibri Global Energy Inc. Common stock,161718981.0,United States,,Energy,Oil & Gas Production
KGS,Kodiak Gas Services Inc. Common Stock,1351404000.0,,2023.0,,
KHC,The Kraft Heinz Company Common Stock,38924652768.0,United States,,Consumer Staples,Packaged Foods
KIDS,OrthoPediatrics Corp. Common Stock,583206110.0,United States,2017.0,Health Care,Medical/Dental Instruments
KIM,Kimco Realty Corporation (HC) Common Stock,10627895304.0,United States,,Real Estate,Real Estate Investment Trusts
KIM^L,Kimco Realty Corporation Class L Depositary Shares each of which represents a one-one thousandth fractional interest in a share of 5.125% Class L Cumulative Redeemable Preferred Stock liquidation preference $25000.00 per share,,United States,,,
KIM^M,Kimco Realty Corporation Class M Depositary Shares each of which represents a one-one thousandth fractional interest in a share of 5.25% Class M Cumulative Redeemable Preferred Stock liquidation preference $25000.00 per share,,United States,,,
KIND,Nextdoor Holdings Inc. Class A Common Stock,327687864.0,United States,,Technology,Computer Software: Programming Data Processing
KINS,Kingstone Companies Inc. Common Stock,17991688.0,United States,,Finance,Specialty Insurers
KIO,KKR Income Opportunities Fund Common Shares,0.0,,2013.0,Finance,Investment Managers
KIQ,Kelso Technologies Inc Ordinary Shares,11347466.0,Canada,,,
KIRK,Kirkland's Inc. COMMONSTOCK,21184492.0,United States,2002.0,Miscellaneous,Diversified Commercial Services
KITT,Nauticus Robotics Inc. Common stock,91172280.0,United States,2021.0,Industrials,Industrial Machinery/Components
KITTW,Nauticus Robotics Inc. Warrant,11394044.0,United States,2021.0,Industrials,Industrial Machinery/Components
KKR,KKR & Co. Inc. Common Stock,48844867799.0,United States,,Finance,Investment Managers
KKRS,KKR Group Finance Co. IX LLC 4.625% Subordinated Notes due 2061,0.0,United States,2021.0,,
KLAC,KLA Corporation Common Stock,63907064190.0,United States,1980.0,Technology,Electronic Components
KLG,WK Kellogg Co Common Stock,848163900.0,,2023.0,Consumer Staples,Packaged Foods
KLIC,Kulicke and Soffa Industries Inc. Common Stock,2526615308.0,Singapore,,Technology,Semiconductors
KLTR,Kaltura Inc. Common Stock,223663488.0,United States,2021.0,Technology,EDP Services
KLXE,KLX Energy Services Holdings Inc. Common Stock,176051627.0,United States,,Energy,Oilfield Services/Equipment
KMB,Kimberly-Clark Corporation Common Stock,41407391113.0,United States,,Consumer Discretionary,Containers/Packaging
KMDA,Kamada Ltd. Ordinary Shares,202488472.0,Israel,2013.0,Health Care,Biotechnology: Pharmaceutical Preparations
KMF,Kayne Anderson NextGen Energy & Infrastructure Inc.,336989879.0,,2010.0,Finance,Investment Managers
KMI,Kinder Morgan Inc. Common Stock,38191200023.0,United States,2011.0,Utilities,Natural Gas Distribution
KMPB,Kemper Corporation 5.875% Fixed-Rate Reset Junior Subordinated Debentures due 2062,1211305181.0,United States,2022.0,Finance,Property-Casualty Insurers
KMPR,Kemper Corporation,2852748612.0,United States,,Finance,Property-Casualty Insurers
KMT,Kennametal Inc. Common Stock,1885967465.0,United States,,Industrials,Industrial Machinery/Components
KMX,CarMax Inc,10188086984.0,United States,,Consumer Discretionary,Retail-Auto Dealers and Gas Stations
KN,Knowles Corporation Common Stock,1245484345.0,United States,2014.0,Consumer Staples,Consumer Electronics/Appliances
KNDI,Kandi Technologies Group Inc Common Stock,275848057.0,China,,Consumer Discretionary,Auto Manufacturing
KNF,Knife Riv Holding Co. Common Stock,2878088968.0,United States,2023.0,,
KNOP,KNOT Offshore Partners LP Common Units representing Limited Partner Interests,211110000.0,United Kingdom,2013.0,Consumer Discretionary,Marine Transportation
KNSA,Kiniksa Pharmaceuticals Ltd. Class A Common Stock,1133195403.0,United States,2018.0,Health Care,Biotechnology: Pharmaceutical Preparations
KNSL,Kinsale Capital Group Inc. Common Stock,10012267063.0,United States,,Finance,Property-Casualty Insurers
KNSW,KnightSwan Acquisition Corporation Class A Common Stock,0.0,,2022.0,Finance,Blank Checks
KNTE,Kinnate Biopharma Inc. Common Stock,58162166.0,United States,2020.0,Health Care,Biotechnology: Pharmaceutical Preparations
KNTK,Kinetik Holdings Inc. Class A Common Stock,5276478961.0,United States,2022.0,Utilities,Natural Gas Distribution
KNW,Know Labs Inc. Common Stock,13581785.0,,2022.0,Industrials,Industrial Machinery/Components
KNX,Knight-Swift Transportation Holdings Inc.,7579205060.0,United States,2017.0,Industrials,Trucking Freight/Courier Services
KO,Coca-Cola Company (The) Common Stock,234703814671.0,United States,,Consumer Staples,Beverages (Production/Distribution)
KOD,Kodiak Sciences Inc Common Stock,82613732.0,United States,2018.0,Health Care,Biotechnology: Biological Products (No Diagnostic Substances)
KODK,Eastman Kodak Company Common New,312728447.0,United States,,Consumer Discretionary,Business Services
KOF,Coca Cola Femsa S.A.B. de C.V.  American Depositary Shares each representing 10 Units (each Unit consists of 3 Series B Shares and 5 Series L Shares),14999942336.0,Mexico,1993.0,Consumer Staples,Beverages (Production/Distribution)
KOP,Koppers Holdings Inc. Common Stock,764967743.0,United States,2006.0,Basic Materials,Forest Products
KOPN,Kopin Corporation Common Stock,133153851.0,United States,1992.0,Technology,Semiconductors
KORE,KORE Group Holdings Inc. Common Stock,47690480.0,United States,,Consumer Discretionary,Telecommunications Equipment
KOS,Kosmos Energy Ltd. Common Shares (DE),3483028135.0,Bermuda,2011.0,Energy,Oil & Gas Production
KOSS,Koss Corporation Common Stock,27612037.0,United States,,Consumer Staples,Consumer Electronics/Appliances
KPLT,Katapult Holdings Inc. Common Stock,41784569.0,United States,2019.0,Consumer Discretionary,Diversified Commercial Services
KPLTW,Katapult Holdings Inc. Warrant,40216.0,United States,2019.0,Consumer Discretionary,Diversified Commercial Services
KPRX,Kiora Pharmaceuticals Inc.  Common Stock,4275035.0,United States,,Health Care,Biotechnology: In Vitro & In Vivo Diagnostic Substances
KPTI,Karyopharm Therapeutics Inc. Common Stock,128077085.0,United States,2013.0,Miscellaneous,Diversified Commercial Services
KR,Kroger Company (The) Common Stock,31818933440.0,United States,,Consumer Staples,Food Chains
KRC,Kilroy Realty Corporation Common Stock,3522367914.0,United States,1997.0,Real Estate,Real Estate Investment Trusts
KREF,KKR Real Estate Finance Trust Inc. Common Stock,735979550.0,United States,2017.0,Real Estate,Real Estate Investment Trusts
KREF^A,KKR Real Estate Finance Trust Inc. 6.50% Series A Cumulative Redeemable Preferred Stock,,United States,,,
KRG,Kite Realty Group Trust Common Stock,4567347609.0,United States,2004.0,Real Estate,Real Estate Investment Trusts
KRKR,36Kr Holdings Inc. American Depositary Shares,31576676.0,China,2019.0,Consumer Discretionary,Business Services
KRMD,KORU Medical Systems Inc. Common Stock (DE),118205220.0,United States,,Health Care,Medical/Dental Instruments
KRNL,Kernel Group Holdings Inc. Class A Ordinary Shares,0.0,United States,2021.0,Finance,Blank Checks
KRNT,Kornit Digital Ltd. Ordinary Shares,767500000.0,Israel,2015.0,Industrials,Industrial Machinery/Components
KRNY,Kearny Financial Corp Common Stock,445417787.0,United States,2005.0,Finance,Savings Institutions
KRO,Kronos Worldwide Inc Common Stock,817842084.0,United States,,Industrials,Major Chemicals
KRON,Kronos Bio Inc. Common Stock,51767575.0,United States,2020.0,Health Care, Medicinal Chemicals and Botanical Products 
KROS,Keros Therapeutics Inc. Common Stock,837098245.0,United States,2020.0,Health Care,Biotechnology: Pharmaceutical Preparations
KRP,Kimbell Royalty Partners Common Units Representing Limited Partner Interests,1413733712.0,United States,2017.0,Energy,Oil & Gas Production
KRT,Karat Packaging Inc. Common Stock,434553652.0,United States,2021.0,Industrials,Plastic Products
KRTX,Karuna Therapeutics Inc. Common Stock,6459658739.0,United States,2019.0,Health Care,Biotechnology: Pharmaceutical Preparations
KRUS,Kura Sushi USA Inc. Class A Common Stock,721948630.0,United States,2019.0,Consumer Discretionary,Restaurants
KRYS,Krystal Biotech Inc. Common Stock,3096435918.0,United States,2017.0,Health Care,Biotechnology: Biological Products (No Diagnostic Substances)
KSCP,Knightscope Inc. Class A Common Stock,60238446.0,United States,2022.0,Telecommunications,Telecommunications Equipment
KSM,DWS Strategic Municipal Income Trust,0.0,United States,1989.0,Finance,Trusts Except Educational Religious and Charitable
KSS,Kohl's Corporation Common Stock,2315609508.0,United States,1992.0,Consumer Discretionary,Department/Specialty Retail Stores
KT,KT Corporation Common Stock,6234639209.0,South Korea,,Telecommunications,Telecommunications Equipment
KTB,Kontoor Brands Inc. Common Stock ,2626057214.0,United States,2019.0,Consumer Discretionary,Apparel
KTCC,Key Tronic Corporation Common Stock,47352232.0,United States,1983.0,Technology,Electrical Products
KTF,DWS Municipal Income Trust,296644144.0,United States,1988.0,Finance,Finance Companies
KTH,Structures Products Cp 8% CorTS Issued by Peco Energy Cap Tr II Preferred Stock,0.0,United States,,Finance,Investment Managers
KTN,Structured Products Corp 8.205% CorTS 8.205% Corporate Backed Trust Securities (CorTS),0.0,United States,,Finance,Finance: Consumer Services
KTOS,Kratos Defense & Security Solutions Inc. Common Stock,2225668653.0,United States,,Industrials,Military/Government/Technical
KTRA,Kintara Therapeutics Inc. Common Stock,7771516.0,United States,,Health Care,Biotechnology: Pharmaceutical Preparations
KTTA,Pasithea Therapeutics Corp. Common Stock,11633816.0,United States,2021.0,Health Care,Biotechnology: Pharmaceutical Preparations
