Symbol,Name,Market Cap,Country,IPO Year,Sector,Industry
PSA^G,Public Storage Depositary Shares Each Representing 1/1000 of a 5.05% Cumulative Preferred Share of Beneficial Interest Series G,,United States,,,
PSA^H,Public Storage Depositary Shares Each Representing 1/1000 of a  5.60% Cumulative Preferred  Share of Beneficial Interest Series H,,United States,,,
PSA^I,Public Storage Depositary Shares Each Representing 1/1000 of a 4.875% Cumulative Preferred Share of Beneficial Interest Series I par value $0.01 per share,,United States,,,
PSA^J,Public Storage Depositary Shares Each Representing 1/1000 of a 4.700% Cumulative Preferred Share of Beneficial Interest Series J par value $0.01 per share,,United States,,,
PSA^K,Public Storage Depositary Shares Each Representing 1/1000 of a 4.75% Cumulative Preferred Share of Beneficial Interest Series K,,United States,,,
PSA^L,Public Storage Depositary Shares Each Representing 1/1000 of a 4.625% Cumulative Preferred Share of Beneficial Interest Series L par value $0.01 per share,,United States,,,
PSA^M,Public Storage Depositary Shares Each Representing 1/1000 of a 4.125% Cumulative Preferred Share of Beneficial Interest Series M,,United States,,,
PSA^N,Public Storage Depositary Shares Each Representing 1/1000 of a 3.875% Cumulative Preferred Share of Beneficial Interest Series N,,United States,,,
PSA^O,Public Storage Depositary Shares Each Representing 1/1000 of a 3.900% Cumulative Preferred Share of Beneficial Interest Series O,,United States,,,
PSA^P,Public Storage Depositary Shares Each Representing 1/1000 of a 4.000% Cumulative Preferred Share of Bene cial Interest Series P,,United States,,,
PSA^Q,Public Storage Depositary Shares Each Representing 1/1000 of a 3.950% Cumulative Preferred Share of Beneficial Interest Series Q par value $0.01 per share,,United States,,,
PSA^R,Public Storage Depositary Shares Each Representing 1/1000 of a 4.00% Cumulative Preferred Share of Bene cial Interest Series R,,United States,,,
PSA^S,Public Storage Depositary Shares Each Representing 1/1000 of a 4.100% Cumulative Preferred Share of Beneficial Interest Series S,,United States,,,
PSEC,Prospect Capital Corporation Common Stock,2390405933.0,United States,2004.0,Finance,Finance: Consumer Services
PSEC^A,Prospect Capital Corporation 5.35% Series A Fixed Rate Cumulative Perpetual Preferred Stock,,United States,,,
PSF,Cohen & Steers Select Preferred and Income Fund Inc. Common Stock,835452980.0,,2010.0,Finance,Investment Managers
PSFE,Paysafe Limited Common Shares,669068400.0,,2021.0,Consumer Discretionary,Business Services
PSHG,Performance Shipping Inc. Common Shares,24044888.0,Greece,,Consumer Discretionary,Marine Transportation
PSMT,PriceSmart Inc. Common Stock,2258816642.0,United States,,Consumer Discretionary,Department/Specialty Retail Stores
PSN,Parsons Corporation Common Stock,6063421159.0,United States,2019.0,Technology,EDP Services
PSNL,Personalis Inc. Common Stock,52186930.0,United States,2019.0,Health Care,Medical Specialities
PSNY,Polestar Automotive Holding UK PLC Class A ADS,5306504130.0,Sweden,,Consumer Discretionary,Auto Manufacturing
PSNYW,Polestar Automotive Holding UK PLC Class C-1 ADS (ADW),786586378.0,Sweden,,Consumer Discretionary,Auto Manufacturing
PSO,Pearson Plc Common Stock,7868280000.0,United Kingdom,,Consumer Discretionary,Books
PSQH,PSQ Holdings Inc. Class A Common Stock,155224016.0,,2021.0,Consumer Discretionary,Advertising
PSTG,Pure Storage Inc. Class A Common Stock,10712570105.0,United States,2015.0,Technology,Electronic Components
PSTL,Postal Realty Trust Inc. Class A Common Stock,276329413.0,United States,2019.0,Real Estate,Real Estate Investment Trusts
PSTV,PLUS THERAPEUTICS Inc. Common Stock ,3458424.0,United States,,Health Care,Medical/Dental Instruments
PSTX,Poseida Therapeutics Inc. Common Stock,202949325.0,United States,2020.0,Health Care,Biotechnology: Biological Products (No Diagnostic Substances)
PSX,Phillips 66 Common Stock,51550983425.0,United States,,Energy,Integrated oil Companies
PT,Pintec Technology Holdings Limited American Depositary Shares,10622692.0,China,2018.0,Technology,Computer Software: Programming Data Processing
PTA,Cohen & Steers Tax-Advantaged Preferred Securities and Income Fund Common Shares of Beneficial Interest,936332362.0,United States,2020.0,Finance,Trusts Except Educational Religious and Charitable
PTC,PTC Inc. Common Stock,17068608262.0,United States,,Technology,Computer Software: Prepackaged Software
PTCT,PTC Therapeutics Inc. Common Stock,1864034088.0,United States,2013.0,Health Care,Biotechnology: Pharmaceutical Preparations
PTEN,Patterson-UTI Energy Inc. Common Stock,2881751176.0,United States,1993.0,Energy,Oil & Gas Production
PTGX,Protagonist Therapeutics Inc. Common Stock,842242743.0,United States,2016.0,Health Care,Biotechnology: Pharmaceutical Preparations
PTHR,Pono Capital Three Inc. Class A Ordinary Shares,0.0,United States,2023.0,Finance,Blank Checks
PTHRW,Pono Capital Three Inc. Warrant,0.0,United States,2023.0,Finance,Blank Checks
PTIX,Protagenic Therapeutics Inc. Common Stock,3897863.0,United States,,Health Care,Biotechnology: Pharmaceutical Preparations
PTIXW,Protagenic Therapeutics Inc. Warrant,121267.0,United States,,Health Care,Biotechnology: Pharmaceutical Preparations
PTLO,Portillo's Inc. Class A Common Stock,812195594.0,United States,2021.0,Consumer Discretionary,Restaurants
PTMN,Portman Ridge Finance Corporation Common Stock,174378976.0,United States,2006.0,Finance,Finance: Consumer Services
PTN,Palatin Technologies Inc. Common Stock,24968490.0,United States,1999.0,Health Care,Biotechnology: Pharmaceutical Preparations
PTON,Peloton Interactive Inc. Class A Common Stock,1702922031.0,United States,2019.0,Consumer Discretionary,Recreational Games/Products/Toys
PTPI,Petros Pharmaceuticals Inc. Common Stock,3233762.0,United States,,Health Care,Biotechnology: Pharmaceutical Preparations
PTRS,Partners Bancorp Common Stock,134711972.0,United States,,Finance,Major Banks
PTSI,P.A.M. Transportation Services Inc. Common Stock,416890280.0,United States,1986.0,Industrials,Trucking Freight/Courier Services
PTVE,Pactiv Evergreen Inc. Common stock,1437789580.0,United States,2020.0,Consumer Discretionary,Containers/Packaging
PTWO,Pono Capital Two Inc. Class A Common Stock,0.0,United States,2022.0,Finance,Blank Checks
PTWOW,Pono Capital Two Inc. Warrants,0.0,United States,2022.0,Finance,Blank Checks
PTY,Pimco Corporate & Income Opportunity Fund,0.0,United States,2002.0,Finance,Investment Managers
PUBM,PubMatic Inc. Class A Common Stock,626565585.0,United States,2020.0,Technology,Computer Software: Prepackaged Software
PUCK,Goal Acquisitions Corp. Common Stock,0.0,United States,2021.0,Finance,Blank Checks
PUCKW,Goal Acquisitions Corp. Warrant,0.0,United States,2021.0,Finance,Blank Checks
PUK,Prudential Public Limited Company Common Stock,28936292698.0,United Kingdom,,Finance,Life Insurance
PULM,Pulmatrix Inc. Common Stock,7231159.0,United States,2014.0,Health Care,Biotechnology: Pharmaceutical Preparations
PUMP,ProPetro Holding Corp. Common Stock,1215683206.0,United States,2017.0,Energy,Oilfield Services/Equipment
PUYI,Puyi Inc. American Depository Shares,332333865.0,China,2019.0,Finance,Investment Managers
PVBC,Provident Bancorp Inc. (MD) Common Stock,167837483.0,United States,2015.0,Finance,Major Banks
PVH,PVH Corp. Common Stock,4502866380.0,United States,,Consumer Discretionary,Apparel
PVL,Permianville Royalty Trust Trust Units ,75075000.0,United States,2011.0,Energy,Oil & Gas Production
PW,Power REIT (MD) Common Stock,2474114.0,United States,1998.0,Real Estate,Real Estate Investment Trusts
PW^A,Power REIT 7.75% Series A Cumulative Perpetual Preferred Stock,,United States,,,
PWFL,PowerFleet Inc. Common Stock,75368825.0,United States,,Telecommunications,Telecommunications Equipment
PWM,Prestige Wealth Inc. Ordinary Shares,19532700.0,Hong Kong,2023.0,,
PWOD,Penns Woods Bancorp Inc. Common Stock,148678865.0,United States,,Finance,Major Banks
PWP,Perella Weinberg Partners Class A Common Stock,811836013.0,United States,2020.0,Finance,Finance: Consumer Services
PWR,Quanta Services Inc. Common Stock,24789821002.0,United States,,Industrials,Engineering & Construction
PWSC,PowerSchool Holdings Inc. Class A Common Stock,4251147574.0,United States,2021.0,Technology,Computer Software: Prepackaged Software
PWUP,PowerUp Acquisition Corp. Class A Ordinary Shares,0.0,United States,2022.0,Finance,Blank Checks
PWUPU,PowerUp Acquisition Corp. Unit,0.0,United States,2022.0,Finance,Blank Checks
PWUPW,PowerUp Acquisition Corp. Warrant,0.0,United States,2022.0,Finance,Blank Checks
PX,P10 Inc. Class A Common Stock,1150451900.0,United States,2021.0,Finance,Investment Managers
PXD,Pioneer Natural Resources Company Common Stock,59674809522.0,United States,,Energy,Oil & Gas Production
PXDT,Pixie Dust Technologies Inc. American Depositary Shares ,129379950.0,Japan,2023.0,,
PXLW,Pixelworks Inc.  Common Stock,71955052.0,United States,2000.0,Technology,Semiconductors
PXMD,PaxMedica Inc. Common Stock,4603866.0,United States,2022.0,Health Care, Medicinal Chemicals and Botanical Products 
PXS,Pyxis Tankers Inc. Common Stock,41495000.0,Greece,,Consumer Discretionary,Marine Transportation
PXSAP,Pyxis Tankers Inc. 7.75% Series A Cumulative Convertible Preferred Shares,295984825.0,Greece,,Consumer Discretionary,Marine Transportation
PXSAW,Pyxis Tankers Inc. Warrant,11643251.0,Greece,,Consumer Discretionary,Marine Transportation
PYCR,Paycor HCM Inc. Common Stock,4379129613.0,United States,2021.0,Technology,Computer Software: Prepackaged Software
PYN,PIMCO New York Municipal Income Fund III Common Shares of Beneficial Interest,0.0,United States,2002.0,Finance,Investment Managers
PYPD,PolyPid Ltd. Ordinary Shares,6384968.0,Israel,2020.0,Health Care,Medical/Dental Instruments
PYPL,PayPal Holdings Inc. Common Stock,61004216795.0,United States,,Consumer Discretionary,Business Services
PYR,PyroGenesis Canada Inc. Common Shares,73217962.0,Canada,,Health Care,Biotechnology: Pharmaceutical Preparations
PYXS,Pyxis Oncology Inc. Common Stock,70357779.0,United States,2021.0,Health Care,Biotechnology: Pharmaceutical Preparations
PZC,PIMCO California Municipal Income Fund III Common Shares of Beneficial Interest,0.0,United States,2002.0,Finance,Investment Managers
PZG,Paramount Gold Nevada Corp. Common Stock,19124434.0,United States,2015.0,Basic Materials,Precious Metals
PZZA,Papa John's International Inc. Common Stock,2194351860.0,United States,1993.0,Consumer Discretionary,Restaurants
QBTS,D-Wave Quantum Inc. Common Shares,83572252.0,,2022.0,Technology,Retail: Computer Software & Peripheral Equipment
QCOM,QUALCOMM Incorporated Common Stock,125259840000.0,United States,1991.0,Technology,Radio And Television Broadcasting And Communications Equipment
QCRH,QCR Holdings Inc. Common Stock,814547046.0,United States,,Finance,Major Banks
QD,Qudian Inc. American Depositary Shares each representing one Class A Ordinary Share,448235409.0,China,2017.0,Finance,Finance: Consumer Services
QDEL,QuidelOrtho Corporation Common Stock,4555788122.0,United States,,Health Care,Medical Specialities
QDRO,Quadro Acquisition One Corp. Class A Ordinary Shares,0.0,United States,2021.0,Finance,Blank Checks
QDROW,Quadro Acquisition One Corp.  Warrant,0.0,United States,2021.0,Finance,Blank Checks
QETAU,Quetta Acquisition Corporation Unit,,United States,2023.0,,
QFIN,Qifu Technology Inc. American Depositary Shares,2333786623.0,China,2018.0,Finance,Finance: Consumer Services
QFTA,Quantum FinTech Acquisition Corporation Common Stock,0.0,,2021.0,Finance,Blank Checks
QGEN,Qiagen N.V. Common Shares ,8557717600.0,Netherlands,,Health Care,Biotechnology: Biological Products (No Diagnostic Substances)
QH,Quhuo Limited American Depository Shares,8758022.0,China,2020.0,Consumer Discretionary,Business Services
QIPT,Quipt Home Medical Corp. Common Shares,195639450.0,United States,,Health Care,Misc Health and Biotechnology Services
QLGN,Qualigen Therapeutics Inc. Common Stock,4546711.0,United States,2015.0,Health Care,Biotechnology: Pharmaceutical Preparations
QLI,Qilian International Holding Group Ltd. Ordinary Shares,26108225.0,China,2021.0,Health Care,Biotechnology: Pharmaceutical Preparations
QLYS,Qualys Inc. Common Stock,5971586120.0,United States,2012.0,Technology,Computer Software: Prepackaged Software
QMCO,Quantum Corporation Common Stock,53222740.0,United States,,Technology,Electronic Components
QNCX,Quince Therapeutics Inc. Common Stock,36877798.0,United States,2019.0,Health Care,Biotechnology: Biological Products (No Diagnostic Substances)
QNRX,Quoin Pharmaceuticals Ltd. American Depositary Shares,3958740.0,Israel,2016.0,Health Care,Medical/Dental Instruments
QNST,QuinStreet Inc. Common Stock,588988831.0,United States,2010.0,Consumer Discretionary,Advertising
QOMO,Qomolangma Acquisition Corp. Common Stock,0.0,United States,2022.0,Finance,Blank Checks
QOMOR,Qomolangma Acquisition Corp. Right,0.0,United States,2022.0,Finance,Blank Checks
QOMOW,Qomolangma Acquisition Corp. Warrant,0.0,United States,2022.0,Finance,Blank Checks
QQQX,Nuveen NASDAQ 100 Dynamic Overwrite Fund Shares of Beneficial Interest,0.0,United States,,Finance,Finance Companies
QRHC,Quest Resource Holding Corporation Common Stock,142803005.0,United States,,Utilities,Environmental Services
QRTEA,Qurate Retail Inc. Series A Common Stock ,206718787.0,United States,,Consumer Discretionary,Catalog/Specialty Distribution
QRTEB,Qurate Retail Inc. Series B Common Stock ,3075316173.0,United States,,Consumer Discretionary,Catalog/Specialty Distribution
QRTEP,Qurate Retail Inc. 8.0% Fixed Rate Cumulative Redeemable Preferred Stock,9933543390.0,United States,,Consumer Discretionary,Catalog/Specialty Distribution
QRVO,Qorvo Inc. Common Stock,8989157955.0,United States,,Technology,Semiconductors
QS,QuantumScape Corporation Class A Common Stock,2734210822.0,United States,2020.0,Consumer Discretionary,Auto Parts:O.E.M.
QSG,QuantaSing Group Limited American Depositary Shares,133874463.0,China,2023.0,Real Estate,Other Consumer Services
QSI,Quantum-Si Incorporated Class A Common Stock,25121250.0,United States,2020.0,Health Care,Biotechnology: Pharmaceutical Preparations
QSR,Restaurant Brands International Inc. Common Shares,20320282725.0,Canada,2014.0,Consumer Discretionary,Restaurants
QTRX,Quanterix Corporation Common Stock,744855543.0,United States,2017.0,Industrials,Biotechnology: Laboratory Analytical Instruments
QTWO,Q2 Holdings Inc. Common Stock,1898927825.0,United States,2014.0,Technology,Computer Software: Prepackaged Software
QUAD,Quad Graphics Inc Class A Common Stock,233873138.0,United States,,Consumer Discretionary,Publishing
QUBT,Quantum Computing Inc. Common Stock,66346658.0,United States,,Technology,Computer Software: Prepackaged Software
QUIK,QuickLogic Corporation Common Stock,130181248.0,United States,1999.0,Technology,Semiconductors
QURE,uniQure N.V. Ordinary Shares,298626927.0,Netherlands,2014.0,Health Care,Biotechnology: Pharmaceutical Preparations
QVCC,QVC Inc. 6.250% Senior Secured Notes due 2068,9.0,United States,2019.0,Consumer Discretionary,Catalog/Specialty Distribution
QVCD,QVC Inc. 6.375% Senior Secured Notes due 2067,0.0,United States,2018.0,Consumer Discretionary,Catalog/Specialty Distribution
R,Ryder System Inc. Common Stock,4615553822.0,United States,,Consumer Discretionary,Rental/Leasing Companies
RA,Brookfield Real Assets Income Fund Inc. Common Stock,0.0,,2016.0,Finance,Investment Managers
RACE,Ferrari N.V. Common Shares,58675433395.0,Italy,2015.0,Consumer Discretionary,Auto Manufacturing
RAIL,FreightCar America Inc. Common Stock,51380634.0,United States,2005.0,Industrials,Railroads
RAIN,Rain Oncology Inc. Common Stock,37470579.0,United States,2021.0,Health Care,Biotechnology: Pharmaceutical Preparations
RAMP,LiveRamp Holdings Inc. Common Stock,1912225171.0,United States,2018.0,Technology,EDP Services
RAND,Rand Capital Corporation Common Stock,33630704.0,United States,,Finance,Finance/Investors Services
RANI,Rani Therapeutics Holdings Inc. Class A Common Stock,99296432.0,United States,2021.0,Health Care, Medicinal Chemicals and Botanical Products 
RAPT,RAPT Therapeutics Inc. Common Stock,388418908.0,United States,2019.0,Health Care,Biotechnology: Pharmaceutical Preparations
RARE,Ultragenyx Pharmaceutical Inc. Common Stock,2407378538.0,United States,2014.0,Health Care,Biotechnology: Pharmaceutical Preparations
RAVE,Rave Restaurant Group Inc. Common Stock,30715163.0,United States,,Consumer Discretionary,Food Distributors
RAYA,Erayak Power Solution Group Inc. Class A Ordinary Shares,11578500.0,China,2022.0,Consumer Discretionary,Metal Fabrications
RBA,RB Global Inc. Common Stock,11668812541.0,Canada,,,
RBB,RBB Bancorp Common Stock,242949925.0,United States,2017.0,Finance,Major Banks
RBBN,Ribbon Communications Inc. Common Stock,338015758.0,United States,,Technology,EDP Services
RBC,RBC Bearings Incorporated Common Stock,6455395959.0,United States,2022.0,Industrials,Metal Fabrications
RBCAA,Republic Bancorp Inc. Class A Common Stock,880213072.0,United States,1998.0,Finance,Major Banks
RBCP,RBC Bearings Incorporated 5.00% Series A Mandatory Convertible Preferred Stock,3059898944.0,United States,2022.0,Industrials,Metal Fabrications
RBKB,Rhinebeck Bancorp Inc. Common Stock,71492244.0,United States,2019.0,Finance,Banks
RBLX,Roblox Corporation Class A Common Stock,18725141268.0,United States,2021.0,Technology,EDP Services
RBOT,Vicarious Surgical Inc. Class A Common Stock,52602169.0,Hong Kong,2020.0,Health Care,Medical Specialities
RBT,Rubicon Technologies Inc. Class A Common Stock,61881795.0,,2022.0,Technology,Computer Software: Prepackaged Software
RC,Ready Capital Corproation Common Stock,1712839267.0,United States,2013.0,Real Estate,Real Estate Investment Trusts
RC^C,Ready Capital Corporation 6.25% Series C Cumulative Convertible Preferred Stock,,United States,,,
RC^E,Ready Capital Corporation 6.50% Series E Cumulative Redeemable Preferred Stock,,United States,,,
RCAC,Revelstone Capital Acquisition Corp. Class A Common Stock,0.0,United States,2022.0,Finance,Blank Checks
RCACW,Revelstone Capital Acquisition Corp. Warrant,0.0,United States,2022.0,Finance,Blank Checks
RCAT,Red Cat Holdings Inc. Common Stock,53394069.0,United States,,Industrials,Wholesale Distributors
RCB,Ready Capital Corporation 6.20% Senior Notes due 2026,4011586505.0,United States,2019.0,Real Estate,Real Estate Investment Trusts
RCC,Ready Capital Corporation 5.75% Senior Notes due 2026,4082610864.0,United States,2021.0,Real Estate,Real Estate Investment Trusts
RCEL,Avita Medical Inc. Common Stock,251845362.0,United States,,Health Care,Medical/Dental Instruments
RCFA,RCF Acquisition Corp. Class A Ordinary Shares,0.0,,2021.0,Finance,Blank Checks
RCG,RENN Fund Inc Common Stock,0.0,United States,,Finance,Investment Managers
RCI,Rogers Communication Inc. Common Stock,20000937440.0,Canada,,Telecommunications,Cable & Other Pay Television Services
RCKT,Rocket Pharmaceuticals Inc. Common Stock,1366518261.0,United States,2015.0,Health Care,Biotechnology: Pharmaceutical Preparations
RCKTW,Rocket Pharmaceuticals Inc. Warrant,,United States,,Health Care,Biotechnology: Pharmaceutical Preparations
RCKY,Rocky Brands Inc. Common Stock,104158082.0,United States,1993.0,Consumer Discretionary,Shoe Manufacturing
RCL,Royal Caribbean Cruises Ltd. Common Stock,21167604654.0,United States,1993.0,Consumer Discretionary,Marine Transportation
RCM,R1 RCM Inc. Common Stock,4761463523.0,United States,,Consumer Discretionary,Other Consumer Services
RCMT,RCM Technologies Inc. Common Stock,156961756.0,United States,,Consumer Discretionary,Professional Services
RCON,Recon Technology Ltd. Class A Ordinary Shares,12705597.0,China,2009.0,Energy,Oilfield Services/Equipment
RCRT,Recruiter.com Group Inc. Common Stock,1547917.0,United States,,Technology,EDP Services
RCRTW,Recruiter.com Group Inc. Warrant,11861.0,United States,,Technology,EDP Services
RCS,PIMCO Strategic Income Fund Inc.,0.0,United States,1994.0,Finance,Investment Managers
RCUS,Arcus Biosciences Inc. Common Stock,1189823514.0,United States,2018.0,Health Care,Biotechnology: Pharmaceutical Preparations
RDCM,Radcom Ltd. Ordinary Shares,128239450.0,Israel,1997.0,Technology,Computer peripheral equipment
RDFN,Redfin Corporation Common Stock,590391489.0,United States,2017.0,Finance,Real Estate
RDHL,Redhill Biopharma Ltd. American Depositary Shares,4884431.0,Israel,,Health Care,Biotechnology: Pharmaceutical Preparations
RDI,Reading International Inc Class A Common Stock,46105988.0,United States,,Consumer Discretionary,Movies/Entertainment
RDIB,Reading International Inc Class B Common Stock,333878626.0,United States,,Consumer Discretionary,Movies/Entertainment
RDN,Radian Group Inc. Common Stock,4067097171.0,United States,,Finance,Property-Casualty Insurers
RDNT,RadNet Inc. Common Stock,1985737971.0,United States,,Health Care,Medical Specialities
RDUS,Schnitzer Steel Industries Inc. Class A Common Stock,705043321.0,United States,,Consumer Discretionary,Industrial Specialties
RDVT,Red Violet Inc. Common Stock ,270478265.0,United States,,Technology,Computer Software: Prepackaged Software
RDW,Redwire Corporation Common Stock,172600135.0,United States,2021.0,Industrials,Military/Government/Technical
RDWR,Radware Ltd. Ordinary Shares,705938589.0,Israel,1999.0,Consumer Discretionary,Business Services
RDY,Dr. Reddy's Laboratories Ltd Common Stock,11154037134.0,India,,Health Care,Biotechnology: Pharmaceutical Preparations
RDZN,Roadzen Inc. Ordinary Shares,253066809.0,United States,2022.0,Finance,Blank Checks
RDZNW,Roadzen Inc. Warrants,2662348.0,United States,2022.0,Finance,Blank Checks
REAL,The RealReal Inc. Common Stock,160373091.0,United States,2019.0,Consumer Discretionary,Other Specialty Stores
REAX,The Real Brokerage Inc. Common Shares,270000000.0,Canada,,Finance,Real Estate
REBN,Reborn Coffee Inc. Common Stock,5600873.0,United States,2022.0,Consumer Discretionary,Restaurants
REE,REE Automotive Ltd. Class A Ordinary Shares,834685200.0,Israel,,Consumer Discretionary,Auto Manufacturing
REFI,Chicago Atlantic Real Estate Finance Inc. Common Stock,264451968.0,United States,2021.0,Real Estate,Real Estate Investment Trusts
REFR,Research Frontiers Incorporated Common Stock,37868845.0,United States,,Miscellaneous,Multi-Sector Companies
REG,Regency Centers Corporation Common Stock,10241382666.0,United States,1993.0,Real Estate,Real Estate Investment Trusts
REGCO,Regency Centers Corporation 5.875% Series B Cumulative Redeemable Preferred Stock,0.0,United States,,,
REGCP,Regency Centers Corporation 6.25% Series A Cumulative Redeemable Preferred Stock,0.0,United States,,,
REGN,Regeneron Pharmaceuticals Inc. Common Stock,87653565675.0,United States,1991.0,Health Care,Biotechnology: Pharmaceutical Preparations
REI,Ring Energy Inc. Common Stock,366293949.0,United States,,Energy,Oil & Gas Production
REKR,Rekor Systems Inc. Common Stock,197165828.0,United States,,Telecommunications,Telecommunications Equipment
RELI,Reliance Global Group Inc. Common Stock,4331796.0,United States,,Finance,Specialty Insurers
RELIW,Reliance Global Group Inc. Series A Warrants,131834.0,United States,,Finance,Specialty Insurers
RELL,Richardson Electronics Ltd. Common Stock,151615803.0,United States,1983.0,Technology,Electronic Components
RELX,RELX PLC PLC American Depositary Shares (Each representing One Ordinary Share),66785693535.0,United Kingdom,2015.0,Consumer Discretionary,Business Services
RELY,Remitly Global Inc. Common Stock,4957250677.0,United States,2021.0,Technology,Computer Software: Prepackaged Software
RENB,Renovaro Biosciences Inc. Common Stock,231914448.0,United States,,Health Care,Biotechnology: Pharmaceutical Preparations
RENE,Cartesian Growth Corporation II Class A Ordinary Shares,0.0,United States,2022.0,Finance,Blank Checks
RENT,Rent the Runway Inc. Class A Common Stock,42887233.0,United States,2021.0,Consumer Discretionary,Other Specialty Stores
REPL,Replimune Group Inc. Common Stock,854856764.0,United States,2018.0,Health Care,Biotechnology: Pharmaceutical Preparations
REPX,Riley Exploration Permian Inc. Common Stock,648298673.0,United States,1999.0,Energy,Oil & Gas Production
RERE,ATRenew Inc. American Depositary Shares (every three of which representing two Class A ordinary shares),349165733.0,,2021.0,Consumer Discretionary,Other Specialty Stores
RES,RPC Inc. Common Stock,1970403708.0,United States,,Energy,Oilfield Services/Equipment
RETO,ReTo Eco-Solutions Inc. Common Shares,4169500.0,China,2017.0,Consumer Discretionary,Multi-Sector Companies
REVB,Revelation Biosciences Inc. Common Stock,4219193.0,United States,2020.0,Health Care,Biotechnology: Pharmaceutical Preparations
REVBW,Revelation Biosciences Inc. Warrant,108314.0,United States,2020.0,Health Care,Biotechnology: Pharmaceutical Preparations
REVG,REV Group Inc. Common Stock,902091517.0,United States,2017.0,Consumer Discretionary,Auto Manufacturing
REX,REX American Resources Corporation,646938415.0,United States,,Industrials,Major Chemicals
REXR,Rexford Industrial Realty Inc. Common Stock,9334263319.0,United States,2013.0,Real Estate,Real Estate Investment Trusts
REXR^B,Rexford Industrial Realty Inc. 5.875% Series B Cumulative Redeemable Preferred Stock,,United States,,,
REXR^C,Rexford Industrial Realty Inc. 5.625% Series C Cumulative Redeemable Preferred Stock par value $0.01 per share,,United States,,,
REYN,Reynolds Consumer Products Inc. Common Stock,5416138067.0,United States,2020.0,Consumer Discretionary,Containers/Packaging
REZI,Resideo Technologies Inc. Common Stock ,2174304483.0,United States,2018.0,Industrials,Wholesale Distributors
RF,Regions Financial Corporation Common Stock,15703746743.0,United States,,Finance,Major Banks
